Emri,Cmimi aktual,Cmimi i vjeter
Aksesore vere Antidrip Ring BOJ 01219201,220,290
Aksesore kuzhine kapese 16 cm BOJ 01211001,370,490
Hapese vere Double Step SOMMELIER BOJ 00996101,370,490
Qeruese Bergner Gizmo 18cm BG-3217,440,590
Luge gatimi Bergner Gizmo 33.5x6.5cm BG-3243,440,590
Qerues patatesh BOJ 021071001,440,590
Rende Bergner Gizmo 25cm BG-3225,440,590
Rrahese Bergner Gizmo 26.5cm BG-3280,440,590
Servires makaronash Bergner Gizmo BG-3063,520,690
Qeruese Bergner Gizmo 19cm BG-3218,520,690
Garuzhde Bergner Gizmo 32.5cm BG-3244,520,690
Spatul embelsirash Bergner Gizmo 40cm BG-3273,520,690
Aksesore shampanje Champagne Stopper BOJ 01215401,520,690
Tas plastik Tefal 1.2L K3021412,590,790
Kapak tigani Bergner Orion 20cm BG-2731,590,790
Spatul embelsirash Bergner Gizmo BG-3272,590,790
Kapsule kafe AMA Deccafeinato 10 cop,590,590
Tas qelqi Bergner 400ml BG-25027-RD,590,790
Tas plastik Tefal 2.3L K3021512,740,990
Kapak tigani Bergner Orion 16cm BG-2730,740,990
Aksesore shampanje Bottle Stopper BOJ 01213801,750,990
Ftohes 1.5 l per shampanje BOJ 01315204,820,"1,090"
Spatul gatimi Bergner Gizmo 35cm BG-3236,890,"1,190"
Kullese Bergner Gizmo BG-3271,890,"1,190"
Spatul gatimi Bergner Gizmo 34cm BG-3277,890,"1,190"
Aromatizues fshese Electrolux ES MA,900,900
Spatul gatimi Bergner Gizmo 36x7.2cm BG-3346,960,"1,290"
Aksesore vere preres Red BOJ 011480101,970,"1,290"
Aksesore vere preres Grey BOJ 011480201,970,"1,290"
Aksesore vere preres Ocher BOJ 011480301,970,"1,290"
Aksesore vere preres Blue BOJ 011480401,970,"1,290"
Aksesore vere preres Green BOJ 011480501,970,"1,290"
Aksesore vere preres Black BOJ 011480801,970,"1,290"
Aksesore vere preres Brown BOJ 011480701,970,"1,290"
Tas qelqi Bergner 950ml BG-25028-RD,970,"1,290"
Garuzhde Bergner Gizmo 29.5cm BG-3233,970,"1,290"
Aromatizues fshese Electrolux ES CO,990,990
Aromatizues fshese Electrolux ES BA,990,990
Filter fshese Electrolux EF 31,"1,000","1,000"
Gershere kuzhine 5-Blade BOJ 01200501,"1,040","1,390"
Prerese pizza BOJ 021120301,"1,080","1,450"
Kapak tigani Bergner Orion 30cm BG-2734,"1,120","1,490"
"Aksesore shampanje ""ICE"" Chrome bottle stopper BOJ 01223704","1,120","1,490"
Pakete qese Electrolux E200S,"1,190","1,190"
Kapak tigani Bergner Orion 28cm BG-2733,"1,190","1,590"
Shtypese patatesh Bergner Gizmo BG-3232,"1,190","1,190"
Kullese Bergner Gizmo BG-3278,"1,190","1,590"
Hapese vere Eki BOJ 00996404,"1,190","1,590"
"Aksesore vere ""ICE"" Wine pourer BOJ 01223304","1,190","1,590"
Termus qelqi Benetton 550ml BE-0301,"1,190","1,190"
Pakete qese Zanussi ZA120,"1,190","1,190"
Filter fshese Electrolux EF 17,"1,200","1,200"
Rende universale 6 Way Inox BOJ 021121602,"1,260","1,690"
Aksesore kuzhine thyese Seafood Cracker BOJ 00881501,"1,270","1,690"
Aksesore kuzhine mbrojtese nxehtesie 15 x 15 cm BOJ 01111002,"1,270","1,690"
Pakete qese Electrolux E201S,"1,290","1,290"
Pakete qese Electrolux ES53,"1,300","1,300"
Hapese vere Cork Extractor BOJ 00990504,"1,350","1,790"
Tigan Tefal FP24 B5670453,"1,350","1,790"
Tigan Bergner Orion FP20cm BG-8508-MBG,"1,350","1,790"
Pakete qese Electrolux E203S,"1,390","1,390"
Filter fshese Philips FC8001/01,"1,390","1,390"
Termus qelqi Benetton 500ml BE-0798-YE,"1,390","1,390"
Dekalcifikues ekspresi Delonghi DLSC200,"1,390","1,390"
Tostier Vivax TS-7504BX,"1,390","2,490"
Pakete qese Electrolux ES49,"1,400","1,400"
Kapak Tigani Bergner BG-2708,"1,420","1,890"
Aksesore vere me pomp vakumi BOJ 01216504,"1,420","1,890"
Tigan Tefal FP26 B5670553,"1,420","1,890"
Tigan Tefal PCKP25 B5671053,"1,420","1,890"
Kapak qelqi Tefal KQ24 28097512,"1,490","1,990"
Pakete qese Electrolux E206S,"1,490","1,490"
Tigan Tefal FP28 B5670653,"1,490","1,990"
Filter fshese Electrolux EF150,"1,490","1,490"
Peshore Tefal PP1400V0,"1,490","1,890"
Cajnik qelqi Benetton 600 ml BE-0682-BK,"1,490","1,990"
Filter fshese Electrolux EFH 12,"1,600","1,600"
Kapak qelqi Tefal KQ26 28097612,"1,710","2,290"
Thyese arrash BOJ 00880101,"1,710","2,290"
Aksesore vere ftohes Bottle Cooler BOJ 01227004,"1,720","2,290"
Ftohes 3.8 l per shampanje BOJ 01315504,"1,790","2,390"
Tigan Tefal C20 B5673053,"1,790","2,390"
Aksesore gatimi Bergner Gizmo 4cp BG-3181,"1,860","2,490"
Hapese vere Double Lever BOJ 00990304,"1,870","2,490"
Hapese vere Cellar Type BOJ 00990404,"1,870","2,490"
Filter fshese Rowenta ZR850001,"1,890","1,890"
Pakete qese Electrolux E210S,"1,990","1,990"
Tharese flokesh Philips BHC010/10,"1,990","2,490"
Filter fshese Electrolux EF 124B,"1,990","1,990"
Filter fshese Rowenta ZR005901,"1,990","1,990"
Filter fshese Electrolux F156,"1,990","1,990"
Tigan Bergner Gourmet SP16cm 1.3L BG-6372,"2,020","2,690"
Tigan Bergner Orion FP28cm BG-8511-MBG,"2,020","2,690"
Koke makine rroje Philips TT2000/43,"2,090","2,090"
Tigan Tefal G24 G7300455,"2,090","2,790"
Koke furce Oclean 2 pcs PW09 Green,"2,190","2,190"
Koke furce Oclean 2 pcs PW03 Pink,"2,190","2,190"
Koke furce Oclean 2 pcs PW05 Blue,"2,190","2,190"
Tenxhere Bergner Orion C20cm 2.2L BG-8514-MBG,"2,250","2,990"
Tigan Tefal WOK28 B5671953,"2,250","2,990"
Depilator Rowenta EP1110F1,"2,290","2,990"
Pjaster Rowenta SF1611LF0,"2,290","2,790"
Filter fshese Rowenta ZR902501,"2,390","2,390"
Termus udhetimi Bergner 400ml BG-37518-MPK,"2,390","2,390"
Tigan Masterpro Odin SP16cm BGMP-3819,"2,390","3,190"
Tostier Vivax TS-7501 WHS,"2,390","2,390"
Doreze tigani e tenxhere Tefal L9933072,"2,490","2,490"
Filter fshese Philips FC8003/01,"2,490","2,490"
Hekur Tefal FV1711E0,"2,490","2,990"
Termus udhetimi Benetton 400ml BE-0298,"2,490","2,490"
Termus udhetimi Benetton 400ml BE-0299,"2,490","2,490"
Hekur Tefal FV1713E0,"2,490","3,490"
Filter fshese Electrolux ESKW1,"2,490","2,490"
Pjaster Rowenta SF321LF0,"2,490","3,590"
Shtrydhese agrumesh Braun MPZ9,"2,520","3,590"
Koke furce Oclean Gum Care 2 pcs W02 White,"2,590","2,590"
Koke furce Oclean P1C10 Grey,"2,590","2,590"
Koke furce Oclean Plague Control 2 pcs B02 Black,"2,590","2,590"
Koke furce Oclean Plague Control 2 pcs W02 White,"2,590","2,590"
Makine shkurtimi HV Philips NT3650/16,"2,590","2,590"
Tostier Noveen SM450,"2,590","2,590"
Tigan Tefal 26X26 B5674053,"2,620","3,490"
Filter hekuri me depozite Tefal XD9030E0,"2,690","2,690"
Hapese vere Cellar Cherry Red BOJ 011000104,"2,690","3,590"
Hapese vere Cellar Steel Grey BOJ 011000204,"2,690","3,590"
Hapese vere Cellar Emerald Green BOJ 011000504,"2,690","3,590"
Hapese vere Cellar Habana Blue BOJ 011000604,"2,690","3,590"
Hapese vere Cellar Black BOJ 011000804,"2,690","3,590"
Depilator Rowenta EP1120F1,"2,690","3,490"
Mashe Rowenta CF2133F0,"2,690","3,090"
Filter fshese Philips FC8074/01,"2,790","2,790"
Mashe Philips BHB862/00,"2,790","3,790"
Hekur Electrolux EDB1730,"2,790","3,990"
Pakete qese Electrolux E200SM,"2,790","2,790"
Depilator Philips BRE224/00,"2,790","4,290"
Pjaster Philips BHS375/00,"2,790","3,990"
Depilator Braun SE1170,"2,790","3,990"
Hekur Tefal FV1710E0,"2,790","3,390"
Thekese Braun HT1010WH,"2,790","3,990"
Tharese flokesh Philips BHD308/10,"2,790","3,590"
Makine shkurtimi mjekre Rowenta TN2809F0,"2,790","3,990"
Makine shkurtimi Braun SK2000,"2,790","3,990"
Blender Noveen SB230 Gray,"2,790","3,590"
Hapese vere Habana Blue BOJ 011110604,"2,850","3,790"
Makine qethje Philips HC3505/15,"2,890","2,890"
Pjaster Rowenta SF1810F0,"2,890","3,490"
Tigan Tefal me kapak STP24 B5673253,"2,920","3,890"
Tigan Tefal P25 G7313855,"2,920","3,890"
Filter fshese Electrolux EF 112B,"2,990","2,990"
Set servisi Renberg Crete 24cp RB-4684-MT,"2,990","3,990"
Mikser dore Tefal HB121838,"2,990","3,790"
Qese vakumi Electrolux EVSB1,"2,990","2,990"
Qese vakumi Bosch MSZV0FB1,"2,990","2,990"
Blender Tefal BL2C0130,"2,990","4,990"
Tigan Tefal G28 G7300655,"2,990","3,990"
Qese vakumi Electrolux EVSR1,"2,990","2,990"
Hekur Braun SI1080VI,"2,990","4,890"
Furce Oclean Endurance Green,"2,990","4,490"
Furce Oclean Endurance Eco Black,"2,990","4,490"
Furce Oclean Endurance Eco White,"2,990","4,490"
Shtrydhese agrumesh Braun CJ3050,"3,150","4,490"
Tigan Bergner Titan FP28cm BG-7927-GY,"3,150","4,190"
Hekur Electrolux EDBT800,"3,190","3,190"
Mikser dore Braun MQ3000 SMOOTHIE,"3,290","4,690"
Pakete qese Electrolux E201SM,"3,290","3,290"
Filter fshese Electrolux EFH 12W,"3,290","3,290"
Depilator Rowenta EP2900F1,"3,290","3,990"
Tostier Tefal SM157236,"3,290","4,290"
Mikser Electrolux EHM3310,"3,290","4,590"
Tharese flokesh Philips BHD340/10,"3,290","3,990"
Hekur Electrolux EDB1740LG,"3,290","4,490"
Ngrohese uji Braun WK1110WH,"3,290","4,690"
Tigan Tefal P26 G2550572,"3,370","4,490"
Tenxhere Tefal B5674653,"3,450","4,590"
Makine shkurtimi mjekre Philips BT3206/14,"3,490","3,490"
Ngrohese uji Braun WK3000WH,"3,490","4,990"
Aparat filtrimi Brita Marella XL,"3,490","3,490"
Furce Oclean Air 2 Green,"3,490","4,690"
Furce Oclean Air 2 Pink,"3,490","4,690"
Furce Oclean Air 2 Purple,"3,490","4,690"
Furce Oclean Air 2 White,"3,490","4,690"
Tostier Tefal SM155212,"3,490","4,990"
Gershere kuzhine profesionale BOJ 01200401,"3,520","4,690"
Shtrydhese agrumesh Bosch MCP3000N,"3,590","3,590"
Tigan Tefal P28 G2550672,"3,670","4,890"
Tigan Tefal P28 G2670672,"3,670","4,890"
Tigan Tefal me kapak W28 G7309955,"3,670","4,890"
Grirese Bosch MMR08A1,"3,690","4,690"
Grirese Bosch MMR08R2,"3,690","4,890"
Tharese flokesh Rowenta CV1831F0,"3,690","3,690"
Tharese flokesh Rowenta CV1830F0,"3,690","3,690"
Ngrohese uji Braun WK300 KE WH,"3,710","5,290"
Tigan set Benetton 20cm+24cm BE-0703,"3,750","4,990"
Makine qethje Philips HC3530/15,"3,790","4,990"
Makine shkurtimi Braun BT3411,"3,850","5,490"
Tigan Tefal PW28 G2551972,"3,890","5,190"
Mikser Bosch MFQ3010S,"3,890","3,890"
Mikser dore BOJ 05160504,"3,890","3,890"
Mikser dore set Bosch MSM14200,"3,990","4,790"
Mulli kafeje Tefal GT110838,"3,990","3,990"
Makine shkurtimi Philips MG3710/15,"3,990","3,990"
Tharese flokesh Philips BHD360/20,"3,990","5,390"
Shtrydhese agrumesh Bosch MCP3500N,"3,990","3,990"
Makine shkurtimi mjekre Rowenta TN2801F4,"3,990","3,990"
Ngrohese uji Electrolux EEWA3330,"3,990","5,490"
Furce Oclean Kids Blue,"3,990","5,990"
Furce Oclean Kids Pink,"3,990","5,990"
Hekur Braun SI3030PU,"4,060","5,790"
Thike Elektrike Kenwood KN650A,"4,110","5,490"
Tenxhere Tefal S24 G7124645,"4,120","5,490"
Hapese vere Black BOJ 01710804,"4,190","5,590"
Makine Qethje Braun SK3000,"4,190","5,990"
Tenxhere Tefal SHAL28 B5677253,"4,190","5,590"
Depilator Braun 3170,"4,190","5,990"
Makine qethje Braun MGK3410,"4,190","5,990"
Hapese vere Habana Blue BOJ 01710604,"4,270","5,690"
Depilator Philips BRE235/00,"4,290","5,690"
Ngrohese uji Electrolux EEWA 3300,"4,290","5,490"
Makine shkurtimi Rowenta TN1350F0,"4,290","4,290"
Tharese flokesh Rowenta CV5940F0,"4,290","5,990"
Mikser dore set Braun MQ3025 OMELETTE,"4,410","6,290"
Tostier Tefal SM193D34,"4,490","5,990"
Makine rroje trupi Philips BG3010/15,"4,490","5,390"
Blender Tefal BL420838,"4,490","5,990"
Tharese flokesh Rowenta CV5830F0,"4,490","4,490"
Mikser dore Electrolux E4HB1-6GG,"4,490","5,990"
Tigan Tefal me kapak S24 G7303255,"4,490","5,990"
Hekur Tefal FV2839E0,"4,490","4,490"
Mashe Rowenta CF321LF0,"4,490","4,490"
Mikser dore Tefal HT460138,"4,490","5,790"
Kafe filter Moulinex FG385A30,"4,490","6,890"
Mikser Electrolux EHM3300,"4,590","4,590"
Hekur Tefal FV5717E0,"4,590","5,790"
Tharese flokesh Philips BHD350/10,"4,590","4,590"
Mikser Bosch MFQ2210DS,"4,690","4,690"
Mbajtese ftohesi shampanje BOJ 01315602,"4,710","6,290"
Mikser dore set Braun MQ3020 PESTO,"4,890","6,990"
Depilator Philips BRE255/00,"4,890","6,490"
Hekur Braun SI3053BL,"4,890","6,990"
Depilator Braun 3-273 Red,"4,890","6,990"
Depilator Braun SE 3-430,"4,890","6,990"
Mikser Bosch MFQ2210D,"4,990","4,990"
Thekese buke Tefal TT130130,"4,990","4,990"
Makine shkurtimi Philips 8 ne 1 MG3730/15,"4,990","4,990"
Pjaster Philips BHS376/00,"4,990","4,990"
Mikser Tefal HT450B38,"4,990","4,990"
Blender BOJ SB-600X,"4,990","4,990"
Makine shkurtimi mjekrre Rowenta 9 ne 1 TN8961F4,"4,990","4,990"
Dezinfektues furce Oclean S1 Grey,"4,990","4,990"
Dezinfektues furce Oclean S1 White,"4,990","4,990"
Furce Oclean Find Duo Set Red/Blue,"4,990","9,990"
Ngrohese uji Tefal KO150F30,"4,990","4,990"
Thekese Braun HT3010BK,"5,040","7,190"
Hekur Braun FI3144BL,"5,180","7,390"
Thika set Bergner Nature 13cp BG-8911-MM,"5,240","6,990"
Mikser dore set Braun MQ3025 SPAGHETTI,"5,250","7,490"
Kreher stilues Philips BHH880/00,"5,290","6,890"
Tharese flokesh Philips BHD272/00,"5,290","6,990"
Makine shkurtimi Rowenta TN6000F5,"5,290","5,290"
Pjaster Philips BHS378/00,"5,290","6,690"
Furce Oclean F1 Light Blue,"5,290","5,290"
Furce Oclean F1 Midnight Blue,"5,290","5,290"
Kafe Filter Bosch TKA3A031,"5,490","6,990"
Mashe Philips BHB868/00,"5,490","6,890"
Mikser dore Tefal HT310838,"5,490","5,490"
Blender Braun JB3100WH,"5,490","8,990"
Qese vakumi Electrolux EVRB1,"5,490","5,490"
Mikser set Bosch MFQ36440S,"5,490","6,990"
Mikser dore set Tefal HB533138,"5,490","6,990"
Makine shkurtimi mjekre Rowenta TN602LF0,"5,490","6,990"
Makine shkurtimi mjekre Rowenta TN3800F4,"5,490","5,490"
Makine shkurtimi Braun BT3241,"5,530","7,890"
Tharese flokesh Rowenta CV5930F0,"5,590","5,590"
Grirese Braun CH3011BK,"5,590","5,590"
Makine shkurtimi mjekre Rowenta TN152LF0,"5,790","5,790"
Kafe filter DeLonghi ICM 2.1 W,"5,990","5,990"
Thekese buke Tefal TT340830,"5,990","5,990"
Makine qethje Philips HC5612/15,"5,990","5,990"
Pjaster Philips BHS510/00,"5,990","7,990"
Blender Kenwood BLP31.A0WH,"5,990","5,990"
Depilator Rowenta EP4920F0,"5,990","7,990"
Ngrohese uji Tefal KO251430,"5,990","5,990"
Furce Oclean Flow Blue,"5,990","5,990"
Furce Oclean Flow White,"5,990","5,990"
Koke furce Oclean Gum Care 6 pcs W06 White,"5,990","5,990"
Pjaster Mashe Philips BHH811/00,"6,290","6,290"
Tharese flokesh Philips BHD512/00,"6,290","7,990"
Kafe filter DeLonghi ICM 2.1B,"6,290","6,290"
Makine qethje Braun MGK3345,"6,290","8,990"
Grirese Bosch MMR15A1,"6,490","8,490"
Kafe filter Electrolux EKF3300,"6,490","6,490"
Thekese Bosch TAT3P424,"6,490","7,990"
Tharese flokesh Philips HPS910/00,"6,490","8,990"
Ngrohese ajri Delonghi HCM2030,"6,490","6,490"
Makine shkurtimi mjekre Philips BT5502/15,"6,690","8,890"
Tave pjekjeje Masterpro Foodies 37.5x27x3cm BGMP-3500,"6,740","8,990"
Tigan WMF PermaDur Excellent 20cm 0575204021,"6,750","8,990"
Depilator Philips BRE285/00,"6,790","8,990"
Grirese Kenwood CHP61.100WH,"6,790","6,790"
Mikrovale Hisense H20MOWP1,"6,790","11,990"
Pompe vakumi + qese ElectroLux EVSK1,"6,990","6,990"
Hekur Rowenta DW5310D1,"6,990","8,990"
Hekur Electrolux E6SI1-4MN,"6,990","6,990"
Pjaster Philips BHS520/00,"6,990","8,990"
Hekur Tefal FV5770E0,"6,990","8,990"
Hekur Tefal FV6812E0,"7,290","7,290"
Tharese flokesh Philips BHD501/00,"7,390","7,390"
Blender Braun JB3060BL,"7,420","10,590"
Gatues me avull Tefal VC139810,"7,490","7,490"
Depilator Braun SES 5/500,"7,690","10,990"
Tharese flokesh Philips BHD530/00,"7,790","9,890"
Fshese Electrolux ECC21-4SB,"7,990","15,990"
Hekur Tefal FV6820E0,"7,990","9,990"
Mashe Rowenta set CF4231F0,"7,990","7,990"
Hekur Tefal FV5737E0,"7,990","7,990"
Ngrohese uji Electrolux E3K1-3ST,"7,990","7,990"
Makine vakumi Electrolux E4VS1-4AG,"7,990","11,990"
Mulli kafeje DeLonghi KG89,"7,990","10,790"
Ngrohese uji Bosch TWK3P420,"7,990","7,990"
Mikser dore set Electrolux E5HB1-6SS,"7,990","7,990"
Blender Bosch MMB2111S,"7,990","7,990"
Blender Moulinex LM480810,"7,990","11,990"
Friteze me ajer Hisense H06AFBS1S3,"7,990","13,990"
Makine shkurtimi Philips MG7950/15,"7,990","11,490"
Tharese flokesh Rowenta CV887LF0,"7,990","7,990"
Hekur Tefal FV6872E0,"8,190","11,690"
Pjaster Philips BHS530/00,"8,290","9,990"
Makine rroje Braun 310Blk/Blu,"8,330","11,890"
Makine qethje Braun MGK7320,"8,390","11,990"
Mashe Rowenta CF9530F0,"8,490","8,490"
Blender Nutribullet NB505DG,"8,490","8,490"
Blender Nutribullet NB606DG,"8,490","10,990"
Blender Nutribullet NB606R Red,"8,490","10,990"
Fshese Samsung VCC4135S37/BOL,"8,690","8,690"
Blender Braun JB3150WH,"8,750","12,490"
Fshese Rowenta RO3753EA,"8,990","14,490"
Fshese Rowenta RO3731EA,"8,990","11,990"
Tigan WMF Permadur Excellent 28 0575284021,"8,990","11,990"
Tavoline hekurosje Tefal TI1200E1,"8,990","8,990"
Mikser dore set Tefal HB656838,"8,990","8,990"
Depilator Philips BRE710/00,"8,990","12,490"
Mikser dore set Bosch MS6CB61V1,"8,990","12,490"
Blender Electrolux E4TB1-6ST,"8,990","11,590"
Hekur Tefal FV5695E1,"8,990","10,990"
Tharese flokesh Rowenta CV7920F0,"8,990","11,890"
Blender Electrolux E3TB1-4GG,"8,990","8,990"
Blender Bosch MMB6141B,"8,990","11,990"
Mikser Bosch MFQ36460S,"8,990","8,990"
Hekur Electrolux E7SI1-8DB,"8,990","11,990"
Makine shkurtimi Rowenta 13 ne 1 TN9140F4,"8,990","8,990"
Makine shkurtimi Rowenta 10 ne 1 TN944MF0,"8,990","12,990"
Grille Hisense HCG2100S,"8,990","16,990"
Makine shkurtimi Philips MG7920/15,"9,490","9,490"
Fshese Samsung VCC4320S3A/BOL,"9,690","9,690"
Mikser Tefal HT312138,"9,690","9,690"
Makine rroje trupi Philips BG7025/15,"9,790","12,890"
Blender Tefal BL438831,"9,790","9,790"
Tavoline hekurosje Braun IB3001BK,"9,790","13,990"
Aksesor MUM4 grirese Bosch MUZ4MM3,"9,990","9,990"
Gatues Multifunksional Tefal RK705138,"9,990","12,990"
Grille Tefal GC205012,"9,990","11,490"
Grille Tefal GC241D38,"9,990","9,990"
Mikser Electrolux ESM3310,"9,990","9,990"
Shtrydhese frutash Braun J300,"9,990","16,990"
Hekur Braun IS1012BL,"9,990","16,490"
Tas + pompe vakumi Electrolux EVFK1,"9,990","9,990"
Pjaster Rowenta SF7660F0,"9,990","9,990"
Fshese Zanussi ZANCG21EB,"9,990","9,990"
Fshese Zanussi ZANCG22CB,"9,990","9,990"
Tostier Tefal SW614831,"9,990","9,990"
Blender BOJ 05150104,"9,990","12,990"
Furce Oclean X PRO Elite Limestone Grey,"9,990","13,690"
Pastrues dentar me uje Oclean W10 Green,"9,990","9,990"
Pastrues dentar me uje Oclean W10 Pink,"9,990","9,990"
Ekspres Hisense HESCM15DBK,"9,990","18,990"
Tharese flokesh Rowenta CV7461F0,"9,990","9,990"
Blender Nutribullet NB907W White,"9,990","13,490"
Fshese Rowenta AC476901,"9,990","9,990"
Makine shkurtimi Rowenta TN6200F4,"9,990","9,990"
Makine shkurtimi Philips 14 ne 1 MG7720/15,"9,990","9,990"
Mikser dore set Braun MQ7045X,"10,360","14,790"
Tigan WMF 36x26 cm 0560364291,"10,490","13,990"
Fshese Rowenta RO2913EA,"10,490","12,990"
Hekur Braun SI7160BL,"10,490","14,990"
Tenxhere me presion BOJ 04010104,"10,490","13,990"
Gatues me avull Braun FS5100BK,"10,490","14,990"
Depilator Philips BRE700/00,"10,690","10,690"
Furce Oclean X PRO Blue,"10,690","10,690"
Furce Oclean X PRO Green,"10,690","10,690"
Furce Oclean X PRO Pink,"10,690","10,690"
Furce Oclean X PRO Purple,"10,690","10,690"
Fshese Samsung VCC4550V36/BOL,"10,990","10,990"
Fshese Rowenta RO2933EA,"10,990","13,990"
Tharese flokesh Philips HP8281/00,"10,990","13,990"
Gatues me presion Tefal CY505E30,"10,990","14,990"
Hekur Tefal SV6116E0,"10,990","12,790"
Fshese Electrolux EEG41CB,"10,990","14,990"
Makine shkurtimi Rowenta TN9320F0,"10,990","10,990"
Friteze me ajer Electrolux EAF5B,"10,990","18,990"
Tenxhere set Tefal G713SB45,"11,250","14,990"
Tharese flokesh Rowenta CV888LF0,"11,390","11,390"
Tharese flokesh Philips HPS920/00,"11,490","13,990"
Grirese mishi Tefal NE105838,"11,990","11,990"
Grirese mishi Tefal NE445138,"11,990","14,990"
Fshese Rowenta RO4825EA,"11,990","14,990"
Fshese Electrolux EC41-H2SW,"11,990","14,990"
Aksesore vere set BOJ 01222904,"11,990","15,990"
Friteze Tefal EY501815,"11,990","15,490"
Makine shkurtimi mjekre Philips BT7510/15,"11,990","11,990"
Blender Electrolux E6TB1-6ST,"11,990","15,790"
Friteze BOJ 05120004,"11,990","11,990"
Fshese Samsung VC18M21N9VD/AD,"11,990","15,990"
Fshese Hisense HVC6134W,"11,990","22,990"
Gatues buke Moulinex OW210A30,"11,990","14,990"
Friteze me ajer Tefal EY145B10,"11,990","11,990"
Fshese Electrolux ECC42IS,"11,990","15,990"
Depilator Braun SE 5-875,"12,590","17,990"
Fshese Rowenta RO3786EA,"12,790","15,990"
Mikrovale Hisense H20MOBP1H,"12,790","12,790"
Hekur Braun IS1512BL,"12,950","18,490"
Shtrydhese agrumesh BOJ 05240204,"12,990","12,990"
Furce Oclean X PRO Digital Gold,"12,990","16,990"
Furce Oclean X PRO Digital Silver,"12,990","16,990"
Furce Oclean X10 Blue,"12,990","12,990"
Furce Oclean X10 Grey,"12,990","12,990"
Furce Oclean X10 Pink,"12,990","12,990"
Furce Oclean X PRO Digital Dark Blue,"12,990","16,990"
Furce Oclean X PRO Digital Purple,"12,990","16,990"
Friteze me ajer Noveen AF550,"12,990","12,990"
Fshese Electrolux ESPC71DB,"13,490","21,990"
Makine shkurtimi Philips MG7745/15,"13,490","13,490"
Ekspres Krups XP320830,"13,490","16,990"
Shtrydhese frutash Braun J700,"13,990","19,990"
Hekur Tefal IT3440E0,"13,990","16,990"
Fshese Electrolux ECC21-2IW,"13,990","13,990"
Friteze Tefal EY201815,"13,990","13,990"
Shtues lageshtie Rowenta HU4020F0,"13,990","17,990"
Fshese Bosch BGBS2LB1,"13,990","13,990"
Fshese Rowenta RY6537WI,"13,990","13,990"
Fshese Samsung VC18M31B0HN/AD,"13,990","18,990"
Hekur Tefal FV8042E0,"13,990","13,990"
Fshese Rowenta RH1129WO,"13,990","17,990"
Ekspres Hisense HCM20CS,"13,990","18,490"
Fshese Electrolux ZPF2220,"14,990","14,990"
Ekspres Delonghi EC235.BK,"14,990","18,990"
Depilator Philips BRE740/10,"14,990","19,990"
Shtrydhese frutash Bosch MES 25A0,"14,990","18,990"
Fshese Electrolux EL61C2DBH,"14,990","19,990"
Mikrovale Hisense H20MOBSD1H,"14,990","14,990"
Mikrovale Hisense H20MOWP1HG,"14,990","14,990"
Gatues Buke Tefal PF210138,"15,490","15,490"
Blender Tefal BL811D38,"15,490","15,490"
Fshese Rowenta RO3985EA,"15,990","15,990"
Stilues flokesh Philips BHB876/00,"15,990","19,990"
Hekur Electrolux E8SI1-8EGM,"15,990","15,990"
Perpunues ushqimi Bosch MCM4100,"15,990","15,990"
Hekur Braun IS1013GR,"15,990","15,990"
Mikrovale Hisense H20MOMP1H,"15,990","15,990"
Fshese Electrolux EB31C1DB,"15,990","15,990"
Hekur Braun IS2132WH,"16,450","23,490"
Tenxhere me presion set BOJ 04011104,"16,490","21,990"
Hekur Tefal FV9844E0,"16,990","16,990"
Ekspres Delonghi EC260.BK,"16,990","21,490"
Blender Bosch MMB6174S,"16,990","16,990"
Hekur Electrolux E6ST1-8EG,"16,990","22,990"
Friteze Delonghi F28211.W1,"16,990","16,990"
Friteze me ajer Hisense HAF2900D,"16,990","16,990"
Hekur Tefal SV8030E0,"16,990","24,990"
Fshese Rowenta RO7C32EA,"16,990","28,990"
Fshese Hisense HVC5101W,"16,990","16,990"
Friteze me ajer Tefal EY505815,"17,490","17,490"
Ekspres Delonghi EC230.BK,"17,990","17,990"
Grille Tefal GC712834,"17,990","22,990"
Perpunues ushqimi Kenwood FDM301SS,"17,990","23,990"
Gatues Buke Tefal PF250135,"17,990","22,990"
Tavoline hekurosje Tefal IB9100E0,"17,990","23,990"
Friteze me ajer Electrolux E6AF1-6ST,"17,990","21,990"
Mikrovale Hisense H23MOBSD1H,"17,990","17,990"
Fshese Electrolux EL61C1CRH,"18,490","18,490"
Tenxhere set Viking GVFPSFS43L,"18,750","24,990"
Fshese Electrolux EPF61RR,"18,990","18,990"
Mikrovale Samsung MS23T5018AK/EO,"18,990","23,990"
Fshese Electrolux EB61C4DB,"18,990","23,990"
Fshese Bosch BCHF2MX16,"18,990","23,990"
Hekur Braun IS3132WH,"19,590","27,990"
Grille Tefal GC306012,"19,990","19,990"
Mikser BOJ FP-4000 05010704,"19,990","19,990"
Mini furre Tefal OF484811,"19,990","26,590"
Mikrovale Hisense H25MOBS7H,"19,990","19,990"
Fshese Rowenta RO4B75EA,"19,990","19,990"
Hekur Braun IS3155VI,"20,290","28,990"
Gatues Buke Tefal PF240E38,"20,990","20,990"
Fshese Bosch BGBS4PET1,"20,990","26,990"
Fshese Electrolux EPF63EB-S,"21,490","21,490"
Thika set WMF Classic 7 cope 1874706030,"21,740","28,990"
Fshese Electrolux EPF62IS,"21,990","21,990"
Hekur Tefal SV8062E0,"21,990","26,990"
Hekur Electrolux E6ST1-4PP,"21,990","21,990"
Fshese Rowenta RH2037WO,"21,990","29,990"
Friteze me ajer Electrolux EAF7SB,"21,990","29,990"
Hekur Tefal IT8490E0,"22,990","28,990"
Fshese Rowenta RO7253EA,"22,990","29,990"
Fshese Rowenta RH6837WO,"22,990","22,990"
Fshese Bosch BGS21X320,"22,990","28,990"
Fshese Electrolux EB61C2DBP,"22,990","28,990"
Makine rroje Philips S7886/55,"22,990","29,990"
Fshese Electrolux EPF65BR,"23,990","23,990"
Ngrohese ajri Delonghi HCX3120FS,"23,990","23,990"
Mikrovale Hisense H29MOBS9HG,"23,990","23,990"
Gatues Buke Tefal PF251835,"23,990","23,990"
Fshese Electrolux EL61C3DB,"24,990","32,990"
Shtrydhese frutash Kenwood JE850,"24,990","31,990"
Hekur Tefal GV9221E0,"24,990","37,990"
Fshese Rowenta RO7260EA,"24,990","31,990"
Hekur Braun IS5145BK,"25,190","35,990"
Hekur Tefal SV9201E0,"25,990","32,990"
Shtrydhese frutash Bosch MES3500,"25,990","25,990"
Fshese Rowenta RH6879WO,"25,990","25,990"
Grille Tefal GC716D12,"25,990","31,990"
Hekur Tefal SV8111E0,"25,990","25,990"
Fshese Electrolux EUSC66-SB,"26,990","26,990"
Ekspres DeLonghi EC685.BK,"26,990","33,990"
Hekur Tefal GV9220E0,"26,990","33,990"
Blender me avull Tefal HB55W430,"26,990","36,990"
Grirese mishi Tefal NE858D38,"26,990","26,990"
Fshese Rowenta RO7B13EA,"27,490","27,490"
Fshese Rowenta RO7212EA,"27,990","27,990"
Fshese Electrolux EUOC9GREEN,"27,990","36,990"
Hekur Tefal SV8130E0,"27,990","27,990"
Grille Tefal GC714834,"27,990","27,990"
Fshese Electrolux EUSC64-EB,"27,990","27,990"
Friteze me ajer Tefal EY801D15,"27,990","27,990"
Fshese Electrolux EUSC62-DB,"28,990","28,990"
Fshese Bosch BWD41700,"28,990","36,990"
Grille Tefal GC722834,"29,990","29,990"
Mikser Tefal QB317538,"29,990","39,990"
Fshese Electrolux PD82-8DB,"29,990","39,990"
Blender Tefal BL91HD31,"31,990","39,990"
Fshese Bosch BGS41POW2,"31,990","39,990"
Depilator Philips Lumea SC1994/00,"32,990","43,990"
Fshese robot iRobot Roomba 698,"32,990","43,990"
Tenxhere me presion set WMF Perfect RDS 0792659990,"33,750","44,990"
Ekspres DeLonghi EC685.M,"33,990","33,990"
Gatues Buke Tefal PF611838,"34,990","34,990"
Fshese Electrolux EUOC94DB,"34,990","34,990"
Ekspres Krups EA810870,"34,990","46,990"
Fshese Bosch BBS611MAT,"34,990","44,990"
Fshese robot Hisense RVCG144AB,"34,990","45,990"
Hekur Tefal GV9721E0,"35,990","48,990"
Fshese Bosch BBH85B2,"35,990","35,990"
Fshese Rowenta RH20C7WO,"35,990","46,990"
Fshese Samsung VS15A60AGR5/GE,"35,990","44,990"
Fshese Electrolux EP71UB14DB,"35,990","49,990"
Ekspres Krups EA810570,"36,990","46,990"
Fshese Bosch BGL6POW2,"36,990","36,990"
Fshese Hitachi PV-XH2M CG CEU,"36,990","49,990"
Depilator Philips Lumea BRI921/00,"37,990","49,990"
