Emri,Cmimi aktual,Cmimi i vjeter
JASTEK UDHETIMI ME AJER TRAVEL BLUE,N/A,1.490
JASTEK UDHETIMI ME AJER TRAVEL BLUE COMFI,N/A,2.390
JASTEK UDHETIMI TRAVEL BLUE SNOWY THE SHEEP,N/A,3.890
JASTEK UDHETIMI TRAVEL BLUE TOBY THE DRAGON,N/A,3.890
JASTEK UDHETIMI TRAVEL BLUE MEMORY FOAM,N/A,3.890
JASTEK UDHETIMI TRAVEL BLUE CHI CHI THE PANDA,N/A,3.890
JASTEK UDHETIMI TRAVEL BLUE TRUNKY THE ELEPHANT,N/A,3.890
JASTEK UDHETIMI TRAVEL BLUE PUFFY THE PENGUIN,N/A,3.890
JASTEK UDHETIMI TRAVEL BLUE TRANQUILLITY,N/A,4.590
