Emri,Cmimi aktual,Cmimi i vjeter
MAKINE QETHESE FUEGO FH-1088,1.090,1.590
MAKINE QETHESE FUEGO YG-90,1.290,1.690
MAKINE QETHESE FUEGO PR-2228,N/A,1.590
MAKINE QETHESE FIRST AUSTRIA FA-5674-4,N/A,1.790
TRIMER ROWENTA TN3011F0,2.190,2.490
MAKINE QETHESE FIRST AUSTRIA FA-5676-5,N/A,2.990
MAKINE QETHESE SET FUEGO RFC-1351,2.990,3.690
MAKINE QETHESE PHILIPS HC3505/15,2.990,3.990
MAKINE QETHESE PHILIPS BT3206/14,2.990,3.990
MAKINE QETHESE FIRST AUSTRIA FA-5676-4,3.190,4.190
MAKINE QETHESE GRUNDIG MC 8030,3.290,4.290
MAKINE QETHESE REMINGTON HC5035,3.490,4.490
MAKINE QETHESE ROWENTA TN1400F0/1,N/A,3.590
MAKINE QETHESE GRUNDIG MC 9030,3.990,4.990
MAKINE QETHESE ROWENTA TN1350F0,N/A,4.790
MAKINE QETHESE REMINGTON PG3000,4.790,6.290
MAKINE QETHESE GRUNDIG MGK 9030,4.790,6.490
MAKINE QETHESE PHL MG3730/15,4.990,5.990
MAKINE QETHESE ROWENTA TN6000F5,4.990,5.990
MAKINE QETHESE ROWENTA  X KARL LAGERFELD TN152LF0,5.290,6.390
MAKINE QETHESE PHILIPS MG5930/15,5.990,7.990
MAKINE QETHESE ROWENTA TN9400F4,6.990,7.990
MAKINE QETHESE PHILIPS MG7940/15,8.490,12.490
MAKINE QETHESE PHILIPS BG7025/15,10.990,13.990
MAKINE QETHESE MULTIFUNKSIONALE PHILIPS MG9552/15,11.990,13.990
MAKINE QETHESE PHILIPS BT9810/15,18.990,22.990
